{
  "cenario": "FN03",
  "modo": "IDEAL",
  "semente_referencia": 42,
  "requisitos": [
    "RF-OPR-01"
  ],
  "assercoes": [
    {
      "id": "A1",
      "nivel": "CARACTERIZACAO",
      "dado": "morador entra na zona cega Z1",
      "quando": "passam 60 s sem detecção",
      "entao": {
        "tipo": "intencao",
        "acao": "APAGAR",
        "causa": "AUSENCIA",
        "entre_ms": [
          60000,
          90000
        ]
      }
    },
    {
      "id": "A2",
      "nivel": "CARACTERIZACAO",
      "dado": "morador permanece na zona cega",
      "quando": "o cenário segue",
      "entao": {
        "tipo": "sem_intencao",
        "acao": "ACENDER",
        "entre_ms": [
          90000,
          600000
        ]
      }
    },
    {
      "id": "A3",
      "nivel": "CARACTERIZACAO",
      "dado": "limitação conhecida",
      "quando": "o cenário termina",
      "entao": {
        "tipo": "metrica",
        "nome": "apagamentos_indevidos",
        "igual": 1
      }
    },
    {
      "id": "INV",
      "nivel": "REQUISITO",
      "dado": "qualquer execução",
      "quando": "o cenário termina",
      "entao": {
        "tipo": "invariantes"
      }
    }
  ]
}