{
  "cenario": "N06",
  "modo": "IDEAL",
  "semente_referencia": 42,
  "requisitos": [
    "RF-OPR-01"
  ],
  "assercoes": [
    {
      "id": "A1",
      "nivel": "REQUISITO",
      "dado": "morador e cachorro na sala",
      "quando": "o morador sai em t=60 s e o cachorro fica andando",
      "entao": {
        "tipo": "luz_constante",
        "valor": "ACESA",
        "entre_ms": [
          6000,
          296000
        ]
      }
    },
    {
      "id": "A2",
      "nivel": "REQUISITO",
      "dado": "o cachorro é ocupante",
      "quando": "o cenário termina",
      "entao": {
        "tipo": "metrica",
        "nome": "apagamentos_indevidos",
        "igual": 0
      }
    },
    {
      "id": "INV",
      "nivel": "REQUISITO",
      "dado": "qualquer execução",
      "quando": "o cenário termina",
      "entao": {
        "tipo": "invariantes"
      }
    }
  ]
}