{
  "cenario": "M05",
  "modo": "IDEAL",
  "semente_referencia": 42,
  "requisitos": [
    "RF-OPR-01"
  ],
  "assercoes": [
    {
      "id": "A1",
      "nivel": "CARACTERIZACAO",
      "dado": "morador parado",
      "quando": "60 s sem detecção",
      "entao": {
        "tipo": "intencao",
        "comodo": "cozinha",
        "acao": "APAGAR",
        "entre_ms": [
          60000,
          100000
        ]
      }
    },
    {
      "id": "A2",
      "nivel": "CARACTERIZACAO",
      "dado": "morador parado no escuro",
      "quando": "o cenário termina",
      "entao": {
        "tipo": "metrica",
        "nome": "escuro_com_ocupante_s",
        "min": 150,
        "comodo": "cozinha"
      }
    },
    {
      "id": "A3",
      "nivel": "REQUISITO",
      "dado": "sala vazia",
      "quando": "60 s depois",
      "entao": {
        "tipo": "luz",
        "comodo": "sala",
        "valor": "APAGADA",
        "em_ms": 120000
      }
    },
    {
      "id": "INV",
      "nivel": "REQUISITO",
      "dado": "qualquer execução",
      "quando": "o cenário termina",
      "entao": {
        "tipo": "invariantes"
      }
    }
  ]
}
