{
  "cenario": "N01",
  "modo": "IDEAL",
  "semente_referencia": 42,
  "requisitos": [
    "RF-OPR-01",
    "RNF-DES-03",
    "CV02",
    "CF05"
  ],
  "assercoes": [
    {
      "id": "A1",
      "nivel": "REQUISITO",
      "dado": "sala vazia e luz apagada",
      "quando": "o morador cruza a porta em t=5 s",
      "entao": {
        "tipo": "luz",
        "valor": "ACESA",
        "desde_ms": 5000,
        "ate_ms": 6000
      }
    },
    {
      "id": "A2",
      "nivel": "REQUISITO",
      "dado": "evidências de presença",
      "quando": "o controlador decide",
      "entao": {
        "tipo": "metrica",
        "nome": "latencia_reacao_ms_p95",
        "max": 500
      }
    },
    {
      "id": "A3",
      "nivel": "REQUISITO",
      "dado": "entrada em sala escura",
      "quando": "a lâmpada acende",
      "entao": {
        "tipo": "metrica",
        "nome": "atraso_percebido_ms_max",
        "max": 1000
      }
    },
    {
      "id": "A4",
      "nivel": "REQUISITO",
      "dado": "morador sempre presente após entrar",
      "quando": "o cenário termina",
      "entao": {
        "tipo": "metrica",
        "nome": "apagamentos_indevidos",
        "igual": 0
      }
    },
    {
      "id": "INV",
      "nivel": "REQUISITO",
      "dado": "qualquer execução",
      "quando": "o cenário termina",
      "entao": {
        "tipo": "invariantes"
      }
    }
  ]
}