{
  "cenario": "M01",
  "modo": "IDEAL",
  "semente_referencia": 42,
  "requisitos": [
    "RF-OPR-01",
    "RNF-DES-03"
  ],
  "assercoes": [
    {
      "id": "A1",
      "nivel": "REQUISITO",
      "dado": "cozinha escura",
      "quando": "o morador cruza o vão",
      "entao": {
        "tipo": "luz",
        "comodo": "cozinha",
        "valor": "ACESA",
        "desde_ms": 40000,
        "ate_ms": 44000
      }
    },
    {
      "id": "A2",
      "nivel": "REQUISITO",
      "dado": "cozinha vazia e acesa",
      "quando": "o morador já voltou para a sala",
      "entao": {
        "tipo": "luz",
        "comodo": "cozinha",
        "valor": "APAGADA",
        "em_ms": 200000
      }
    },
    {
      "id": "A3",
      "nivel": "REQUISITO",
      "dado": "sala vazia enquanto ele está na cozinha",
      "quando": "60 s sem detecção",
      "entao": {
        "tipo": "luz",
        "comodo": "sala",
        "valor": "APAGADA",
        "em_ms": 112000
      }
    },
    {
      "id": "A4",
      "nivel": "REQUISITO",
      "dado": "volta para a sala escura",
      "quando": "cruza o vão de novo",
      "entao": {
        "tipo": "luz",
        "comodo": "sala",
        "valor": "ACESA",
        "desde_ms": 120000,
        "ate_ms": 124000
      }
    },
    {
      "id": "A5",
      "nivel": "REQUISITO",
      "dado": "entrada em cômodo escuro",
      "quando": "a lâmpada acende",
      "entao": {
        "tipo": "metrica",
        "nome": "atraso_percebido_ms_max",
        "max": 1000
      }
    },
    {
      "id": "A6",
      "nivel": "REQUISITO",
      "dado": "cômodo esvaziado",
      "quando": "a luz apaga",
      "entao": {
        "tipo": "metrica",
        "nome": "desperdicio_por_saida_s_max",
        "max": 90
      }
    },
    {
      "id": "A7",
      "nivel": "REQUISITO",
      "dado": "morador sempre presente em algum cômodo",
      "quando": "o cenário termina",
      "entao": {
        "tipo": "metrica",
        "nome": "apagamentos_indevidos",
        "igual": 0
      }
    },
    {
      "id": "INV",
      "nivel": "REQUISITO",
      "dado": "qualquer execução",
      "quando": "o cenário termina",
      "entao": {
        "tipo": "invariantes"
      }
    }
  ]
}
