{
  "cenario": "M02",
  "modo": "IDEAL",
  "semente_referencia": 42,
  "requisitos": [
    "RF-OPR-01"
  ],
  "assercoes": [
    {
      "id": "A1",
      "nivel": "REQUISITO",
      "dado": "cozinha escura",
      "quando": "o morador chega",
      "entao": {
        "tipo": "luz",
        "comodo": "cozinha",
        "valor": "ACESA",
        "desde_ms": 6000,
        "ate_ms": 15000
      }
    },
    {
      "id": "A2",
      "nivel": "REQUISITO",
      "dado": "sala atravessada",
      "quando": "60 s sem detecção",
      "entao": {
        "tipo": "luz",
        "comodo": "sala",
        "valor": "APAGADA",
        "em_ms": 100000
      }
    },
    {
      "id": "A3",
      "nivel": "CARACTERIZACAO",
      "dado": "a sala acende na entrada",
      "quando": "o SA-01 detecta",
      "entao": {
        "tipo": "luz",
        "comodo": "sala",
        "valor": "ACESA",
        "desde_ms": 5000,
        "ate_ms": 6000
      }
    },
    {
      "id": "A4",
      "nivel": "REQUISITO",
      "dado": "sala esvaziada",
      "quando": "a luz apaga",
      "entao": {
        "tipo": "metrica",
        "nome": "desperdicio_por_saida_s_max",
        "max": 90,
        "comodo": "sala"
      }
    },
    {
      "id": "A5",
      "nivel": "REQUISITO",
      "dado": "morador sempre presente",
      "quando": "o cenário termina",
      "entao": {
        "tipo": "metrica",
        "nome": "apagamentos_indevidos",
        "igual": 0
      }
    },
    {
      "id": "INV",
      "nivel": "REQUISITO",
      "dado": "qualquer execução",
      "quando": "o cenário termina",
      "entao": {
        "tipo": "invariantes"
      }
    }
  ]
}
