{
  "cenario": "M10",
  "modo": "IDEAL",
  "semente_referencia": 42,
  "requisitos": [
    "RF-OPR-01",
    "PS05"
  ],
  "assercoes": [
    {
      "id": "A1",
      "nivel": "REQUISITO",
      "dado": "cozinha vazia",
      "quando": "75 s depois",
      "entao": {
        "tipo": "luz",
        "comodo": "cozinha",
        "valor": "APAGADA",
        "em_ms": 140000
      }
    },
    {
      "id": "A2",
      "nivel": "REQUISITO",
      "dado": "cozinha esvaziada",
      "quando": "a luz apaga",
      "entao": {
        "tipo": "metrica",
        "nome": "desperdicio_por_saida_s_max",
        "max": 90,
        "comodo": "cozinha"
      }
    },
    {
      "id": "A3",
      "nivel": "REQUISITO",
      "dado": "casa vazia",
      "quando": "t = 150 s",
      "entao": {
        "tipo": "luz",
        "comodo": "sala",
        "valor": "APAGADA",
        "em_ms": 150000
      }
    },
    {
      "id": "A4",
      "nivel": "REQUISITO",
      "dado": "morador sempre presente até sair",
      "quando": "o cenário termina",
      "entao": {
        "tipo": "metrica",
        "nome": "apagamentos_indevidos",
        "igual": 0
      }
    },
    {
      "id": "INV",
      "nivel": "REQUISITO",
      "dado": "qualquer execução",
      "quando": "o cenário termina",
      "entao": {
        "tipo": "invariantes"
      }
    }
  ]
}
