{
  "cenario": "FN05",
  "modo": "IDEAL",
  "semente_referencia": 42,
  "requisitos": [
    "RF-OPR-01"
  ],
  "assercoes": [
    {
      "id": "A1",
      "nivel": "CARACTERIZACAO",
      "dado": "o cachorro deita e dorme a partir de t=10 s",
      "quando": "passam 60 s sem movimento",
      "entao": {
        "tipo": "intencao",
        "acao": "APAGAR",
        "causa": "AUSENCIA",
        "entre_ms": [
          74000,
          77000
        ]
      }
    },
    {
      "id": "A2",
      "nivel": "CARACTERIZACAO",
      "dado": "o cachorro continua dormindo",
      "quando": "t = 1400 s",
      "entao": {
        "tipo": "luz",
        "valor": "APAGADA",
        "em_ms": 1400000
      }
    },
    {
      "id": "A3",
      "nivel": "CARACTERIZACAO",
      "dado": "o cachorro é ocupante (RN-I0-01)",
      "quando": "o cenário termina",
      "entao": {
        "tipo": "metrica",
        "nome": "apagamentos_indevidos",
        "igual": 1
      }
    },
    {
      "id": "INV",
      "nivel": "REQUISITO",
      "dado": "qualquer execução",
      "quando": "o cenário termina",
      "entao": {
        "tipo": "invariantes"
      }
    }
  ]
}