{
  "cenario": "FP03",
  "modo": "IDEAL",
  "semente_referencia": 42,
  "requisitos": [
    "RF-OPR-01"
  ],
  "assercoes": [
    {
      "id": "A1",
      "nivel": "CARACTERIZACAO",
      "dado": "sala vazia e luz apagada",
      "quando": "o SA dispara por ruído em t=10 s",
      "entao": {
        "tipo": "intencao",
        "acao": "ACENDER",
        "causa": "PASSAGEM_SA",
        "entre_ms": [
          10000,
          10500
        ]
      }
    },
    {
      "id": "A2",
      "nivel": "CARACTERIZACAO",
      "dado": "nenhuma detecção depois",
      "quando": "passam 60 s",
      "entao": {
        "tipo": "intencao",
        "acao": "APAGAR",
        "causa": "AUSENCIA",
        "entre_ms": [
          69500,
          71000
        ]
      }
    },
    {
      "id": "A3",
      "nivel": "CARACTERIZACAO",
      "dado": "limitação conhecida",
      "quando": "o cenário termina",
      "entao": {
        "tipo": "metrica",
        "nome": "desperdicio_s",
        "min": 55,
        "max": 65
      }
    },
    {
      "id": "INV",
      "nivel": "REQUISITO",
      "dado": "qualquer execução",
      "quando": "o cenário termina",
      "entao": {
        "tipo": "invariantes"
      }
    }
  ]
}